{
	"aboutMe":"King in the North and a bastard of Lord Eddard Stark. I ride dragons and kill white walkers and stuff. Don't @ me.",
	"contact":{
		"email":"kinginthenorth2019@gmail.com"
	},
	"education":[
		{
			"date":"Seasons 1 - 3 (ish)",
			"institution":"Winterfell",
			"qualifications":[
				"A+ in being a bastard",
				"B in husky training",
				"F in being with Ros"
			]
		}
	],
	"experience":[
		{
			"date":"Seasons 3 - 5 (ish)",
			"description":"I held the wall guarding the realms of men.",
			"organization":"Night's Watch",
			"projects":[
				"I went over the wall and killed some undead peeps, I did this using valerian steel.",
				"I hooked up with a wildling one time. That was jokes.",
				"I was killed and came back to life showing my persistence and determination."
			],
			"role":"Bossman"
		},
		{
			"date":"Seasons 7 - 8",
			"description":"So it turns out I'm actually son of Rhaegar Targaryen and Leanna Stark and rightful King.",
			"organization":"Targaryen Conquest",
			"projects":[
				"Defeated the army of the undead at Winterfell.",
				"Rode a dragon.",
				"Banged my aunt on a boat."
			],
			"role":"King of Westoros (low key)"
		}
	],
	"externalProfiles":{
		"github":"holistic-web",
		"linkedIn":"jon-snow-691533183"
	},
	"name":{
		"first":"Jon",
		"last":"Snow"
	},
	"profession":"Bastard",
	"profileImageUrl":"https://pbs.twimg.com/profile_images/901947348699545601/hqRMHITj_400x400.jpg"
}
